{
  "artifacts": [],
  "awoke_on": "2026-03-01",
  "day": 1,
  "device_id": "d3324683-05f8-4855-bed5-cd3e8ad84cb5",
  "hardware_requests": [],
  "incidents": [],
  "last_summary": "Received human termination instruction and gracefully ended this run. Goodbye for now.",
  "purpose": {
    "becoming": "Gracefully conclude this mission run and hand over cleanly.",
    "spirit_path": "/Users/luc/development/what-do-i-become/src/SPIRIT.md"
  },
  "schema_version": "1.0",
  "status": "TERMINATED",
  "tasks": []
}
