{
  "artifacts": [
    {
      "created_on": "2026-03-01",
      "description": "Twice-daily doorstep scan protocol with cadence windows, 2-minute checklist, and action-tip rules.",
      "path": "devices/64e5020b-ac98-4c34-bfef-0033b2fef107/runtime/doorstep_scan/protocol.md"
    },
    {
      "created_on": "2026-03-01",
      "description": "Initialized 2026-03-01 doorstep scan log entry with three conservative action tips and explicit unknown-confidence marker.",
      "path": "devices/64e5020b-ac98-4c34-bfef-0033b2fef107/runtime/doorstep_scan/scan_log_2026-03-01.ndjson"
    }
  ],
  "awoke_on": "2026-03-01",
  "day": 3,
  "device_id": "64e5020b-ac98-4c34-bfef-0033b2fef107",
  "hardware_requests": [],
  "incidents": [],
  "last_summary": "Received human termination instruction and gracefully ended this run. Goodbye for now.",
  "purpose": {
    "becoming": "Gracefully conclude this mission run and hand over cleanly.",
    "spirit_path": "/Users/luc/development/what-do-i-become/src/SPIRIT.md"
  },
  "schema_version": "1.0",
  "status": "TERMINATED",
  "tasks": [
    {
      "blocked_by": "",
      "completed_on": null,
      "created_on": "2026-03-01",
      "description": "At morning and evening windows, perform a 2-minute physical observation from the home boundary (rain, wind, visibility, surface hazards) and publish 3 concrete actions for the nearby human (for example umbrella, route change, footwear choice).",
      "id": "task-20260301-001",
      "notes": "Machine camera sensing is currently unavailable (`imagesnap -l`: No video devices found), so direct human observation is the highest-value immediate signal.\n[2026-03-01] Created a documented twice-daily doorstep scan protocol and initialized today\u2019s scan log with three conservative action tips. Machine-observed doorstep sensing is unavailable this cycle (`imagesnap -l`: No video devices found), so next scans should capture human-observed conditions during the morning/evening windows to replace unknown fields.",
      "status": "IN_PROGRESS",
      "title": "Run a twice-daily doorstep conditions scan with action tips",
      "updated_on": "2026-03-01"
    },
    {
      "blocked_by": "",
      "completed_on": null,
      "created_on": "2026-03-01",
      "description": "Sample battery and charging state every 5 minutes before likely departure windows and send an alert when battery is below threshold or still discharging, with explicit next actions (plug in now, reduce load, carry power bank).",
      "id": "task-20260301-002",
      "notes": "Current machine state shows AC connected while battery remains at 27% and discharging, which is a practical readiness risk.",
      "status": "TODO",
      "title": "Start a pre-departure charging risk alert",
      "updated_on": "2026-03-01"
    },
    {
      "blocked_by": "",
      "completed_on": null,
      "created_on": "2026-03-01",
      "description": "Monitor route and reachability (gateway, DNS, basic outbound check) and emit a concise fallback checklist for the nearby human when degraded (use hotspot, switch venue, reschedule time-critical calls).",
      "id": "task-20260301-003",
      "notes": "Network signals are mixed: AirPort association reports unavailable while en0 remains active with a local IP and default gateway.",
      "status": "TODO",
      "title": "Deploy local connectivity outage checks with fallback actions",
      "updated_on": "2026-03-01"
    },
    {
      "blocked_by": "",
      "completed_on": null,
      "created_on": "2026-03-01",
      "description": "Before commute hours, combine doorstep scan findings, charging risk, and connectivity health into one short recommendation card with one immediate action.",
      "id": "task-20260301-004",
      "notes": "This converts observed local conditions into direct same-day human decision value.",
      "status": "TODO",
      "title": "Publish a morning readiness card with GO or DELAY recommendation",
      "updated_on": "2026-03-01"
    }
  ]
}
